card_id,title,geography,solution_status,current_year,annual_value_usd,spread_usd_mwh,active_queue_gw,withdrawn_queue_gw,best_generic_intervention,best_generic_mw,updated_generic_benefit_cost_ratio,recommended_solution,next_action,caveat,trend_summary,constraints,evidence_basis,source_files,active_queue_can_reach_cap,best_generic_benefit_cost_ratio,withdrawn_queue_can_reach_cap
solution_nyis_pjm,NYISO-PJM 2025 congestion relief,NYIS-PJM,priority_solution_study,2025,142391660.94,7.38,85.45703240000006,524.2561670000003,transmission_capacity,50.0,0.42613682344953424,"Use 2025 congestion economics to scope NY import/export relief, storage, and queue-rescue packages.","Rebuild congestion evidence and relief curves on the 2025 NYISO component spread, then price named projects.",Generic costs still do not clear B/C > 1; the value is now high enough for project-specific costing.,2023 $1.53/MWh -> 2024 $2.02/MWh -> 2025 $7.38/MWh (4.8x over observed window).,"PJM:NOTTINGH230 KV  2-3 (6,025 h, severity 353,557); PJM:LENOX-NMESHOPP NML 1090     B  115 KV (1,847 h, severity 227,804); PJM:GRACETON230 KV  GRA-SAF (3,339 h, severity 130,754); PJM:Chicago-Praxair3 138 kV l/o Wilton Center-Dumont 765 kV (661 h, severity 120,695); PJM:Turkey Hill-Hilgard 138 kV l/o Prairie State-Mt Vernon 345 kV (1,065 h, severity 118,169)",NYISO DAM zonal LBMP 2023 (mis.nyiso.com; hourly NYCA internal-zone mean vs NYISO PJM proxy bus); NYISO DAM zonal LBMP 2023 settlement components (mis.nyiso.com; NYCA internal-zone mean vs PJM proxy bus),reports\congestion_evidence_report.json; reports\queue_match.json; reports\grid_relief_curves.json; reports\miso_seam_evidence_2024.csv; reports\nyiso_seam_2024_2025.txt,True,0.08816893267877213,True
solution_miso_swpp,MISO-SPP wind-belt transfer relief,MISO-SWPP,priority_solution_study,2024,25176168.04,6.31,156.53056500000002,344.6546689999996,transmission_capacity,50.0,0.3489975256933514,"Target wind-belt transfer relief: transmission upgrades, storage on the export side, and queue rescue on the import side.",Tie CHAWATCHAPAT/Charlie Creek-Watford constraints to candidate upgrades and rerun relief curves on 2024 spread.,Screening uses MISO-side settlement evidence; SPP-side evidence corroborates but should not be double-counted.,2023 $4.74/MWh -> 2024 $6.31/MWh (1.3x over observed window).,"MISO:CHAR_CK-WATFORD FLO PATINGATE-CHARLIE CK (5,138 h, severity 1,069,182); SPP:CHAWATCHAPAT (5,951 h, severity 895,951); MISO:MORRISOT-GRANTCO FLO HANK-WAP+WAP TR2 (2,453 h, severity 654,610); MISO:FORMAN TR12 FLO WAHPETON-HANKINSON (1,607 h, severity 389,783); SPP:OSAWEBCLESOO (2,078 h, severity 360,524); SPP:TMP499_26328 (2,074 h, severity 316,737)","MISO DA ex-post LMP (docs.misoenergy.org; ARKANSAS.HUB vs SWPP interface, 2023-01-01..2023-12-31)",reports\congestion_evidence_report.json; reports\queue_match.json; reports\grid_relief_curves.json; reports\miso_seam_evidence_2024.csv; reports\nyiso_seam_2024_2025.txt,True,0.26216295907868237,True
solution_ciso_srp,CISO-SRP OASIS-corrected Western screen,CISO-SRP,methodology_validated_screen,2023,14038274.42,1.39,67.99920339144307,389.80194814128896,transmission_capacity,50.0,0.0794409290599759,"Use OASIS-corrected spreads for Western storage/transmission siting screens, not old ICE hub levels.","Replace generic benchmark costs with project-specific storage, flexible-load, or transmission estimates.",OASIS correction made this defensible but much smaller than the old hub-proxy headline.,2023 $1.39/MWh.,,"CAISO OASIS PRC_LMP DAM v12 (TH_SP15_GEN-APND vs PALOVRDE_ASR-APND, 2023-04-01..2024-01-01)",reports\congestion_evidence_report.json; reports\queue_match.json; reports\grid_relief_curves.json; reports\miso_seam_evidence_2024.csv; reports\nyiso_seam_2024_2025.txt,True,0.0794409290599759,True
solution_bpat_ciso,BPAT-CISO OASIS-corrected Western screen,BPAT-CISO,methodology_validated_screen,2023,6059448.930000001,1.11,85.63052639144308,393.60397794128886,transmission_capacity,50.0,0.06229160198033437,"Use OASIS-corrected spreads for Western storage/transmission siting screens, not old ICE hub levels.","Replace generic benchmark costs with project-specific storage, flexible-load, or transmission estimates.",OASIS correction made this defensible but much smaller than the old hub-proxy headline.,2023 $1.11/MWh.,,"CAISO OASIS PRC_LMP DAM v12 (TH_NP15_GEN-APND vs MALIN_5_N101, 2023-04-01..2024-01-01)",reports\congestion_evidence_report.json; reports\queue_match.json; reports\grid_relief_curves.json; reports\miso_seam_evidence_2024.csv; reports\nyiso_seam_2024_2025.txt,True,0.06229160198033437,True
solution_miso_soco,MISO-SOCO Southeast boundary screen,MISO-SOCO,bounded_solution_screen,2024,8194347.99,1.53,261.9142899999999,467.9472000000001,transmission_capacity,50.0,0.08579595841111765,Keep as a Southeast import-boundary screen; use targeted price/constraint evidence before spending design effort.,Attach SOCO/neighbor settlement or planning evidence and compare to Right Kan Southeast bounds.,"Value is smaller than PJM-NYIS and MISO-SWPP, but it anchors Southeast bounds.",2023 $1.35/MWh -> 2024 $1.53/MWh (1.1x over observed window).,"MISO:CHAR_CK-WATFORD FLO PATINGATE-CHARLIE CK (5,138 h, severity 1,069,182); MISO:MORRISOT-GRANTCO FLO HANK-WAP+WAP TR2 (2,453 h, severity 654,610); MISO:FORMAN TR12 FLO WAHPETON-HANKINSON (1,607 h, severity 389,783); MISO:SWAN LK-WILMARTH FLO HELENAMN-SHEASLK (1,924 h, severity 218,268); MISO:CREE-CRES2 FLO CRESTON-SUMMITLK N (829 h, severity 207,932)","MISO DA ex-post LMP (docs.misoenergy.org; MS.HUB vs SOCO interface, 2023-01-01..2023-12-31)",reports\congestion_evidence_report.json; reports\queue_match.json; reports\grid_relief_curves.json; reports\miso_seam_evidence_2024.csv; reports\nyiso_seam_2024_2025.txt,True,0.0757023162451038,True
solution_ercot_west_north,ERCOT West-North congestion watch,ERCO West-North hubs,watchlist_for_solution_screen,2025,0.0,5.78355748373102,0.0,0.0,not_evaluated,0.0,0.0,Run ERCOT-specific queue/site matching before ranking storage or transmission interventions.,Attach ERCOT queue and constraint evidence to the West-North spread trend.,Hub spread trend is directional; no BA tie gross-flow value is attached.,2023 $4.94/MWh -> 2025 $5.78/MWh.,,ERCOT DAM hub spread series,reports\ercot_hub_spreads.json,False,0.0,False
